{
  "iso2": "SD",
  "slug": "soudan",
  "name": "Soudan",
  "namePrep": "au Soudan",
  "region": "Afrique de l'Est",
  "capital": "Khartoum",
  "datePublished": "2026-09-08",
  "dateModified": "2026-09-08",
  "metaDescription": "Situation securitaire au Soudan : conflit arme depuis 2023, ensemble du territoire formellement deconseille, extension au Kordofan, alertes en temps reel avec SentiqS.",
  "keywords": "Soudan securite, risque pays Soudan, veille geopolitique Khartoum Darfour, surete entreprise Afrique de l'Est, SentiqS",
  "summary": "Le pays traverse depuis 2023 un conflit extremement meurtrier, qui s'est recemment etendu au Kordofan et au Kordofan meridional, ou des affrontements reguliers opposent l'armee et un groupe rebelle refusant le processus de paix. Il est formellement deconseille de se rendre dans l'ensemble du territoire soudanais, y compris a Khartoum et a Port-Soudan, les regions etant susceptibles d'etre touchees par des frappes aeriennes, notamment de drones. Les etats du Darfour connaissent une situation securitaire tres instable, avec des combats gouvernement-rebelles recurrents, un accroissement des heurts intercommunautaires et une violence criminelle (vols, attaques armees, enlevements). Sont egalement formellement deconseilles : la zone de Djebel 'Aouinat (frontiere Egypte-Soudan-Libye, ou des milices sevissent en toute impunite), la frontiere avec l'Ethiopie (groupes armes et milices, dont le Triangle d'el Fashaga et des camps de refugies tigreens), et le parc Dinder dans l'Etat de Sennar (groupes armes et coupeurs de route). Le risque d'attaques terroristes contre les interets occidentaux est reel sur tout le territoire, et des attaques de pirates, y compris par les Houthis, visent des navires etrangers pres des cotes.",
  "threats": {
    "terrorism": {
      "title": "Conflit Arme depuis 2023 et Territoire Formellement Deconseille",
      "text": "Le pays traverse depuis 2023 un conflit extremement meurtrier, qui s'est recemment etendu au Kordofan et au Kordofan meridional, ou des affrontements reguliers opposent l'armee et un groupe rebelle refusant le processus de paix. Il est formellement deconseille de se rendre dans l'ensemble du territoire soudanais, y compris a Khartoum et a Port-Soudan, les regions etant susceptibles d'etre touchees par des frappes aeriennes, notamment de drones. Le risque d'attaques terroristes contre les interets occidentaux est reel sur tout le territoire."
    },
    "crime": {
      "title": "Darfour et Zones Frontalieres a Haut Risque",
      "text": "Les etats du Darfour connaissent une situation securitaire tres instable, avec des combats gouvernement-rebelles recurrents, un accroissement des heurts intercommunautaires et une violence criminelle (vols, attaques armees, enlevements). Sont egalement formellement deconseilles : la zone de Djebel 'Aouinat (frontiere Egypte-Soudan-Libye, ou des milices sevissent en toute impunite), la frontiere avec l'Ethiopie (groupes armes et milices, dont le Triangle d'el Fashaga et des camps de refugies tigreens), et le parc Dinder dans l'Etat de Sennar (groupes armes et coupeurs de route). La criminalite est tres forte compte tenu de la forte degradation de la situation securitaire et de l'importante circulation d'armements."
    },
    "infra": {
      "title": "Piraterie Maritime",
      "text": "Des attaques de pirates, y compris par les Houthis, sont signalees contre des navires etrangers pres des cotes soudanaises et au large."
    }
  },
  "neighbors": [
    { "name": "Egypte", "slug": "egypte", "available": true },
    { "name": "Libye", "slug": "libye", "available": true },
    { "name": "Tchad", "slug": "tchad", "available": false },
    { "name": "Centrafrique", "slug": "centrafrique", "available": true },
    { "name": "Soudan du Sud", "slug": "soudan-du-sud", "available": true },
    { "name": "Ethiopie", "slug": "ethiopie", "available": true },
    { "name": "Erythree", "slug": "erythree", "available": true }
  ],
  "alertsSample": [
    { "tag": "SURETE", "text": "Frappe aerienne signalee dans la region de Khartoum.", "time": "Il y a 2h" },
    { "tag": "SURETE", "text": "Affrontement signale au Kordofan meridional.", "time": "Il y a 1j" },
    { "tag": "SURETE", "text": "Attaque armee signalee dans un etat du Darfour.", "time": "Il y a 2j" }
  ],
  "sources": [
    "https://www.diplomatie.gouv.fr/fr/information-par-pays/soudan/conseils-aux-voyageurs-securite (France Diplomatie, consulte le 08/09/2026)"
  ]
}
